<?xml version="1.0" encoding="UTF-8"?>
<?xml-stylesheet type="text/css" href="esempio.css"?>
<lettera xsi:noNamespaceSchemaLocation="esempio.xsd" xmlns:xsi="http://www.w3.org/2001/XMLSchema-instance">
<mittente>Romeo Rossi</mittente>
<data>2012-09-28</data>
<destinatario>Giulietta Verdi</destinatario>
<oggetto>Riunione operativa</oggetto>
<forma_cortesia>Egregia Dott.ssa Verdi </forma_cortesia>
<corpo>
<paragrafo>come da accordi telefonici, indico la riunione operativa per il 3 ottobre 2012 alle ore 10:00. Prego di portare tutti i documenti relativi al progetto
</paragrafo>
</corpo>
<chiusura>Cordiali Saluti
</chiusura>
<firma>Romeo Rossi
</firma>
</lettera>
